{
  "artifact_digests": [
    {"artifact_id": "validate-w01-log", "command_id": "validate-w01", "path": "validate-w01.log", "sha256": "a2c99af5f1c652581ffb7f6d6502857938d5478a74a4e10c3cb52c34521cbbfe", "size_bytes": 55},
    {"artifact_id": "validate-w02-log", "command_id": "validate-w02", "path": "validate-w02.log", "sha256": "97c7fba0c60e0cdf3e48df6b3b44ecd5dd83e5d26bae581b64ac723f9827a97a", "size_bytes": 8125},
    {"artifact_id": "validate-w03-log", "command_id": "validate-w03", "path": "validate-w03.log", "sha256": "20ff54391a69c42b2348d53ad3a1dde3933f98ed1412bcc6bbd8102311eacc03", "size_bytes": 373},
    {"artifact_id": "generate-w04-profile-log", "command_id": "generate-w04-profile", "path": "generate-w04-profile.log", "sha256": "09dcb2ad0920a35faf5ccd9ca9aa54a18f251f7b655016c270bf2d054eb605c5", "size_bytes": 85},
    {"artifact_id": "check-w04-contract-log", "command_id": "check-w04-contract", "path": "check-w04-contract.log", "sha256": "cad7c7a37187b1d0ebc68eb6bb2c074c968c2efa3133f397820ca777f71fb838", "size_bytes": 102},
    {"artifact_id": "validate-w04-log", "command_id": "validate-w04", "path": "validate-w04.log", "sha256": "76b6975ebc79fde45cf48d19c1e2c7d2b71a38a5ccd9be47e334f2f34e182425", "size_bytes": 92},
    {"artifact_id": "w04-tests-log", "command_id": "w04-tests", "path": "w04-tests.log", "sha256": "09509181f985f86e29217e9ea89d5b1e85bb24c3d501bc7c6a231c1c846a5d4b", "size_bytes": 11613},
    {"artifact_id": "w04-candidate-log", "command_id": "w04-candidate", "path": "w04-candidate.log", "sha256": "c8e5801389c3e1f5d7d818aa51906fccba64d9789acac425ab49bac793c0ac03", "size_bytes": 15195},
    {"artifact_id": "w04-zts-log", "command_id": "w04-zts", "path": "w04-zts.log", "sha256": "d75b70d5d686da0eeff894b4f3d7eb015c3212d227f9719d510fdd0cd7de8a9f", "size_bytes": 15195},
    {"artifact_id": "w04-asan-log", "command_id": "w04-asan", "path": "w04-asan.log", "sha256": "48e3f86f5f3b11236b5e1e7998ecc78f9a4d7e068642162cff0a66eebf4ed8b4", "size_bytes": 437},
    {"artifact_id": "w04-ubsan-log", "command_id": "w04-ubsan", "path": "w04-ubsan.log", "sha256": "99925f0060c70042ec0df36d4e338fce3cd212448f1e7192e123b642807caec5", "size_bytes": 440},
    {"artifact_id": "w04-fuzz-20000-log", "command_id": "w04-fuzz-20000", "path": "w04-fuzz-20000.log", "sha256": "b9fe7d6f7d7f53572cfc4a5a31fe2f45d3eb37a58d2e14529b1b488a8086560f", "size_bytes": 680},
    {"artifact_id": "build-debug-nts-log", "command_id": "build-debug-nts", "path": "build-debug-nts.log", "sha256": "9c11da53997214e7df5e4f6256151613d876fe65d8a06873c217eba5f16e1d85", "size_bytes": 949439},
    {"artifact_id": "smoke-debug-nts-log", "command_id": "smoke-debug-nts", "path": "smoke-debug-nts.log", "sha256": "d6b116d8f7a1f893c5cced321a05551539cf630fcb873cca40431563c35d1721", "size_bytes": 2559},
    {"artifact_id": "build-debug-zts-log", "command_id": "build-debug-zts", "path": "build-debug-zts.log", "sha256": "6aec207b54036f0a218374859c74449e6bf521e62635543579b638ffc2a089f3", "size_bytes": 963913},
    {"artifact_id": "smoke-debug-zts-log", "command_id": "smoke-debug-zts", "path": "smoke-debug-zts.log", "sha256": "d1efe92e782a41849bdb012998e7e0cdd4f4f2d633a91294ca1680991c539300", "size_bytes": 2559}
  ],
  "capabilities_provided": [
    "reducible_control_flow"
  ],
  "codegen_eligible": false,
  "command_manifest": [
    {"artifact_id": "validate-w01-log", "command": "/opt/homebrew/opt/python@3.14/bin/python3.14 scripts/native/semantics/validate-w01.py --check", "command_id": "validate-w01", "exit_code": 0},
    {"artifact_id": "validate-w02-log", "command": "/opt/homebrew/opt/python@3.14/bin/python3.14 scripts/native/mir/validate-w02.py --check", "command_id": "validate-w02", "exit_code": 0},
    {"artifact_id": "validate-w03-log", "command": "/opt/homebrew/opt/python@3.14/bin/python3.14 scripts/native/lowering/validate-w03.py --check", "command_id": "validate-w03", "exit_code": 0},
    {"artifact_id": "generate-w04-profile-log", "command": "/opt/homebrew/opt/python@3.14/bin/python3.14 scripts/native/control-flow/generate-w04-profile.py --check", "command_id": "generate-w04-profile", "exit_code": 0},
    {"artifact_id": "check-w04-contract-log", "command": "/opt/homebrew/opt/python@3.14/bin/python3.14 scripts/native/control-flow/check-contract.py --check", "command_id": "check-w04-contract", "exit_code": 0},
    {"artifact_id": "validate-w04-log", "command": "/opt/homebrew/opt/python@3.14/bin/python3.14 scripts/native/control-flow/validate-w04.py --check", "command_id": "validate-w04", "exit_code": 0},
    {"artifact_id": "w04-tests-log", "command": "/opt/homebrew/opt/python@3.14/bin/python3.14 -m unittest discover -s tests/native/control-flow -p 'test_*.py' -v", "command_id": "w04-tests", "exit_code": 0},
    {"artifact_id": "w04-candidate-log", "command": "/opt/homebrew/opt/python@3.14/bin/python3.14 scripts/native/control-flow/test-w04.py --reference-php /Volumes/CrucialMusic/src/php/php-src/sapi/cli/php --candidate-php /var/folders/p7/wnljx3ss3hn3dhkmk_0nt27c0000gn/T/php-native-w00/php-src-A-16a405aa927f37c5/w04-debug-nts/build/sapi/cli/php", "command_id": "w04-candidate", "exit_code": 0},
    {"artifact_id": "w04-zts-log", "command": "/opt/homebrew/opt/python@3.14/bin/python3.14 scripts/native/control-flow/test-w04.py --reference-php /Volumes/CrucialMusic/src/php/php-src/sapi/cli/php --candidate-php /var/folders/p7/wnljx3ss3hn3dhkmk_0nt27c0000gn/T/php-native-w00/php-src-A-16a405aa927f37c5/w04-debug-zts/build/sapi/cli/php", "command_id": "w04-zts", "exit_code": 0},
    {"artifact_id": "w04-asan-log", "command": "/opt/homebrew/opt/python@3.14/bin/python3.14 scripts/native/control-flow/test-w04.py --reference-php /Volumes/CrucialMusic/src/php/php-src/sapi/cli/php --candidate-php /var/folders/p7/wnljx3ss3hn3dhkmk_0nt27c0000gn/T/php-native-w00/php-src-A-16a405aa927f37c5/w04-asan-nts/build/sapi/cli/php --sanitizer address", "command_id": "w04-asan", "exit_code": 0},
    {"artifact_id": "w04-ubsan-log", "command": "/opt/homebrew/opt/python@3.14/bin/python3.14 scripts/native/control-flow/test-w04.py --reference-php /Volumes/CrucialMusic/src/php/php-src/sapi/cli/php --candidate-php /var/folders/p7/wnljx3ss3hn3dhkmk_0nt27c0000gn/T/php-native-w00/php-src-A-16a405aa927f37c5/w04-ubsan-nts/build/sapi/cli/php --sanitizer undefined", "command_id": "w04-ubsan", "exit_code": 0},
    {"artifact_id": "w04-fuzz-20000-log", "command": "/opt/homebrew/opt/python@3.14/bin/python3.14 tests/native/control-flow/fuzz/run_fuzz.py --seed 20260719 --cases 20000", "command_id": "w04-fuzz-20000", "exit_code": 0},
    {"artifact_id": "build-debug-nts-log", "command": "scripts/native/build.sh --profile debug-nts", "command_id": "build-debug-nts", "exit_code": 0},
    {"artifact_id": "smoke-debug-nts-log", "command": "scripts/native/test-smoke.sh --profile debug-nts", "command_id": "smoke-debug-nts", "exit_code": 0},
    {"artifact_id": "build-debug-zts-log", "command": "scripts/native/build.sh --profile debug-zts", "command_id": "build-debug-zts", "exit_code": 0},
    {"artifact_id": "smoke-debug-zts-log", "command": "scripts/native/test-smoke.sh --profile debug-zts", "command_id": "smoke-debug-zts", "exit_code": 0}
  ],
  "coverage_report_path": "docs/native-engine/control-flow/w04-coverage-report.json",
  "coverage_report_sha256": "1665ea9d70b305ff394f3432b6070705bfdf5ac3b9831bac610f683b81b0bced",
  "created_at": "2026-07-19T21:41:13Z",
  "definition_path": "docs/native-engine/waves/waves.json",
  "definition_sha256": "d5da0697e9678c2161c983e6371986dc1cedebe6868541cc2a13ac7443154cc3",
  "dependency_receipts": [],
  "format_version": "1.0.0",
  "profile_paths": [
    "docs/native-engine/control-flow/w04-opcode-profile.json"
  ],
  "profile_sha256": [
    "48e140fb1abb14da2eafc58ae3b1e8a3a5462d973dcccd26c414e6291c9a73e6"
  ],
  "review_digests": [],
  "semantic_debts": [
    "call_execution",
    "references_and_cow",
    "dynamic_call_targets",
    "protected_call_continuations",
    "target_emission",
    "internal_c_abi_interop"
  ],
  "state": "revalidated",
  "subject_commit": "8dd2042871905f57ff5429460f1888a5bf3e0677",
  "subject_tree": "8d1fa567e276ad07fcd3396b583c99aac9e1493f",
  "wave_id": "W04"
}
